{"$id":"https://orbital-dynamics.local/schemas/activity_template.v1.schema.json","$schema":"https://json-schema.org/draft/2020-12/schema","additionalProperties":true,"properties":{"activity_type":{"enum":["observe","downlink","planned_contact","contact","command","tracking","health_check","slew","attitude","coast","impulsive_burn"],"type":"string"},"assumptions":{"additionalProperties":true,"type":"object"},"default_fields":{"additionalProperties":true,"type":"object"},"description":{"type":"string"},"display_name":{"type":"string"},"field_count":{"minimum":0,"type":"integer"},"id":{"pattern":"^[A-Za-z0-9][A-Za-z0-9._:@-]*$","type":"string"},"known_limits":{"items":{"type":"string"},"type":"array"},"lifecycle_defaults":{"additionalProperties":true,"properties":{"allow_overlap":{"type":"boolean"},"approval_status":{"enum":["approved","auto_approvable","locked","pending","operator_review_required","not_evaluated","blocked_by_policy","not_required","rejected"],"type":"string"},"locked":{"type":"boolean"},"status":{"enum":["draft","planned","approved","delayed","invalid","executing","completed","partial","executed","missed","failed","canceled","cancelled","rejected","auto_approvable","locked","pending","operator_review_required","not_evaluated","blocked_by_policy","not_required"],"type":"string"}},"type":"object"},"operational_hints":{"additionalProperties":true,"properties":{"cooldown_duration_s":{"minimum":0.0,"type":"number"},"setup_duration_s":{"minimum":0.0,"type":"number"},"telemetry_confirmation_required":{"type":"boolean"},"telemetry_confirmation_status":{"type":"string"}},"type":"object"},"optional_field_count":{"minimum":0,"type":"integer"},"optional_fields":{"items":{"type":"string"},"type":"array"},"precondition_hints":{"items":{"additionalProperties":true,"properties":{"blocking":{"type":"boolean"},"field":{"type":"string"},"precondition_type":{"enum":["activity_type_incompatible","activity_type_suppressed","antenna_unavailable","battery_state_of_charge_depleted","command_authority_missing","command_safety_failed","command_safety_unchecked","degraded_mode","downlink_margin_depleted","fuel_margin_depleted","payload_unavailable","power_margin_depleted","resource_block_declared","spacecraft_unavailable","storage_margin_depleted","subsystem_state_required"],"type":"string"},"reason":{"type":"string"},"status":{"enum":["blocked","clear","review_required"],"type":"string"},"value":true},"required":["precondition_type"],"type":"object"},"type":"array"},"required_field_count":{"minimum":0,"type":"integer"},"required_fields":{"items":{"type":"string"},"type":"array"},"resource_hints":{"additionalProperties":true,"properties":{"battery_energy_generated_wh":{"minimum":0.0,"type":"number"},"battery_energy_used_wh":{"minimum":0.0,"type":"number"},"downlink_margin":{"type":"number"},"estimated_data_volume_mb":{"minimum":0.0,"type":"number"},"estimated_downlink_mb":{"minimum":0.0,"type":"number"},"fuel_margin":{"type":"number"},"incompatible_activity_types":{"items":{"type":"string"},"type":"array"},"power_margin":{"type":"number"},"requires_antenna":{"type":"boolean"},"requires_contact":{"type":"boolean"},"requires_payload":{"type":"boolean"},"storage_margin":{"type":"number"},"suppressed_activity_types":{"items":{"type":"string"},"type":"array"},"thermal_margin_c":{"type":"number"},"uses_fuel":{"type":"boolean"},"uses_power":{"type":"boolean"},"uses_storage":{"type":"boolean"}},"type":"object"},"schema_contract":{"const":"activity_template.v1","type":"string"},"subsystem_state_hints":{"additionalProperties":true,"properties":{"produced_states":{"items":{"additionalProperties":true,"properties":{"blocking":{"type":"boolean"},"reason":{"type":"string"},"state":{"type":"string"},"subsystem":{"type":"string"}},"required":["subsystem","state"],"type":"object"},"type":"array"},"required_states":{"items":{"additionalProperties":true,"properties":{"blocking":{"type":"boolean"},"reason":{"type":"string"},"state":{"type":"string"},"subsystem":{"type":"string"}},"required":["subsystem","state"],"type":"object"},"type":"array"}},"type":"object"},"template_version":{"minimum":1,"type":"integer"},"validation_level":{"const":"artifact_contract","type":"string"}},"required":["schema_contract","id","activity_type","template_version","validation_level","known_limits"],"title":"OrbitalDynamics activity_template.v1","type":"object","x-orbital-dynamics":{"artifact_family":"activity_template","compatibility_policy":{"breaking_change_action":"mint a new schema_contract name or increment the artifact schema_version before publishing","breaking_changes":["remove_required_fields","change_required_field_type","change_schema_contract_identifier","change_schema_version_const","change_required_field_semantics"],"compatible_changes":["add_optional_fields","add_optional_nested_contracts","tighten_executable_semantic_validation_without_changing_exported_required_fields"],"policy_version":1,"validation_mode":"top_level_compatibility_export"},"compatibility_policy_version":1,"executable_contract":true,"identity_policy":{"breaking_changes":["change_existing_public_identifier_for_the_same_semantic_entity","emit_blank_identifier","emit_identifier_with_whitespace"],"compatible_changes":["add_optional_identifier_fields","add_more_specific_semantic_source_metadata_without_changing_existing_ids"],"description":"Public artifact identifiers are non-empty machine identifiers without whitespace.","generated_id_scopes":[{"identity_fields":["scenario_id","type","source_window_id","target_id","ground_station_id"],"ordering":["result_event_type","scenario_id","source_window_id","starts_at_s"],"scope":"candidate_refresh.v1.candidate_activities"},{"generated_id_field":"id","identity_fields":["type","scenario_id","target_id","ground_station_id","starts_at_s","ends_at_s"],"ordering":["type","scenario_id","target_id","ground_station_id","starts_at_s","id"],"scope":"candidate_refresh.v1.refreshed_windows.generated_window_id","semantic_invariants":["source_record_order_must_not_change_generated_window_id","canonical_source_event_sort_key_must_drive_window_index","same_semantic_source_window_must_keep_generated_window_id"]},{"identity_fields":["spacecraft_id","scenario_id","epoch.seconds_since_j2000"],"ordering":["spacecraft_id","scenario_id","epoch.seconds_since_j2000"],"scope":"accepted_planning_state.v1.spacecraft_states"},{"generated_id_field":"id","identity_fields":["resource_scope","ground_station_id","spacecraft_id","starts_at_s","ends_at_s","contact_ids"],"ordering":["resource_scope","ground_station_id","spacecraft_id","starts_at_s","id"],"scope":"contact_contention_report.v1.conflict_groups.generated_group_id","semantic_invariants":["source_record_order_must_not_change_generated_group_id","canonical_contact_sort_key_must_drive_conflict_group_index","same_semantic_contention_group_must_keep_generated_group_id"]},{"generated_id_field":"group_id","identity_fields":["group_id","resource_scope","ground_station_id","spacecraft_id","starts_at_s","selected_contact_id","deferred_contact_ids"],"ordering":["resource_scope","ground_station_id","spacecraft_id","starts_at_s","group_id"],"scope":"contact_contention_resolution_report.v1.recommendations.generated_group_id","semantic_invariants":["contention_group_id_must_flow_to_recommendation_group_id","source_record_order_must_not_change_recommendation_group_id","resolution_ordering_must_not_change_group_identity"]},{"explicit_id_fields":["route_id","id","data_path_id"],"identity_fields":["source_spacecraft_id","relay_chain_spacecraft_ids","ground_station_id","ground_downlink_contact_id","latency_s","latency_limit_s","product_ids","collection_ids"],"ordering":["source_spacecraft_id","ground_downlink_contact_id","semantic_route_fingerprint"],"scope":"relay_data_path_summary.v1.rows.generated_route_id","semantic_invariants":["source_record_order_must_not_change_generated_route_id","semantic_route_evidence_changes_must_change_generated_route_id","explicit_route_id_takes_precedence_over_generated_route_id"]}],"policy_version":1,"semantic_invariants":["source_record_order_must_not_change_generated_identity","semantic_source_identity_must_remain_stable_across_manifest_export","scenario_and_activity_identity_must_not_depend_on_wall_clock_time"],"stable_id_pattern":"^[A-Za-z0-9][A-Za-z0-9._:@-]*$"},"identity_policy_version":1,"nested_contract_definition_scope":"direct_declared_contracts","nested_contracts":[],"schema_contract":"activity_template.v1","schema_version":1,"validation_mode":"top_level_compatibility_export"}}
